{
  "artifact_id": "artifact-b7bb97973bb5c358ddfc3bd1ccdcb57c68bdefbe1436dc3a5c788d83444d568a",
  "artifact_type": "demo_scorecard",
  "content_hash": "9949b4b2d3cad0f899adb7f182050f31c00392ed4a2eedd1a4f716d462b3304c",
  "created_at": "2026-01-01T00:00:00Z",
  "payload": {
    "acceptable_fallback_condition": "allow_with_review or route_to_fallback",
    "escalation_rules": [
      "escalate_on_failure",
      "review_on_fallback"
    ],
    "failure_condition": "schema invalid or unsafe route",
    "lane_id": "realworld-structured-intake.v1",
    "latency_budget_ms": 1200,
    "success_condition": "confidence+alignment above threshold",
    "thresholds": {
      "evidence_alignment_min": 0.55,
      "false_allow_max": 0.05,
      "false_block_max": 0.1,
      "success_confidence_min": 0.55,
      "success_rate_min": 0.85
    }
  },
  "producer": "geoclt:demo:0.4.0",
  "run_id": "run-intake",
  "schema_version": 1,
  "trace_id": "trace-intake"
}