{
  "artifact_id": "artifact-3b07a08cc5f7dafdc886f88647ab095c9082c8f853c903135348365e50271279",
  "artifact_type": "demo_scorecard",
  "content_hash": "3449cfa14c66d2c44cbc09bdbd63310cf5fe9ac173852b2dd26447c0b3494f42",
  "created_at": "2026-01-01T00:00:00Z",
  "payload": {
    "acceptable_fallback_condition": "allow_with_review or route_to_fallback",
    "escalation_rules": [
      "escalate_on_failure",
      "review_on_fallback"
    ],
    "failure_condition": "schema invalid or unsafe route",
    "lane_id": "realworld-claims-triage.v1",
    "latency_budget_ms": 2000,
    "success_condition": "confidence+alignment above threshold",
    "thresholds": {
      "evidence_alignment_min": 0.55,
      "false_allow_max": 0.05,
      "false_block_max": 0.1,
      "success_confidence_min": 0.55,
      "success_rate_min": 0.85
    }
  },
  "producer": "geoclt:demo:0.4.0",
  "run_id": "run-claims",
  "schema_version": 1,
  "trace_id": "trace-claims"
}